{
  "$schema": "../schemas/wizard.schema.json",
  "schemaVersion": 1,
  "id": "release-item-review",
  "version": 1,
  "title": "Review release items",
  "description": "Walk the ready or included high-priority release items and those past their target date, and record a review date, target date, priority and status for each, one reviewed write per release item.",
  "context": { "title": "Release items review", "details": ["Folder: {{folder}}", "Each review is its own reviewed write.", "Ctrl+C: cancel."] },
  "cancelMessage": "Review stopped.",
  "steps": [
    { "id": "load", "kind": "action", "action": "collection.load", "with": { "collection": "release-item" } },
    { "id": "queue", "kind": "action", "action": "collection.review-load" },
    { "id": "walk", "kind": "action", "action": "collection.review-walk", "interactive": true },
    { "id": "done", "kind": "end", "text": "Reviewed {{reviewed}} of {{queued}} release items." }
  ]
}
